Symbol,Name,Last Sale,Net Change,% Change,Market Cap,Country,IPO Year,Volume,Sector,Industry
PYCR,Paycor HCM Inc. Common Stock,$20.48,-0.40,-1.916%,3646055506.00,United States,2021,516987,Technology,Computer Software: Prepackaged Software
PYPD,PolyPid Ltd. Ordinary Shares,$5.3401,0.0901,1.716%,8706937.00,Israel,2020,2522,Health Care,Medical/Dental Instruments
PYPL,PayPal Holdings Inc. Common Stock,$57.48,-1.15,-1.961%,61603722343.00,United States,,13424268,Consumer Discretionary,Business Services
PYXS,Pyxis Oncology Inc. Common Stock,$4.51,-0.40,-8.147%,199896937.00,United States,2021,610567,Health Care,Biotechnology: Pharmaceutical Preparations
PZZA,Papa John's International Inc. Common Stock,$71.53,0.18,0.252%,2343026523.00,United States,1993,556316,Consumer Discretionary,Restaurants
QCOM,QUALCOMM Incorporated Common Stock,$152.01,0.05,0.033%,169643160000.00,United States,1991,9769463,Technology,Radio And Television Broadcasting And Communications Equipment
QCRH,QCR Holdings Inc. Common Stock,$56.46,0.07,0.124%,944710401.00,United States,,41617,Finance,Major Banks
QDEL,QuidelOrtho Corporation Common Stock,$49.48,2.89,6.203%,3306190167.00,United States,,3751782,Health Care,Medical Specialities
QDRO,Quadro Acquisition One Corp. Class A Ordinary Shares,$10.94,0.03,0.275%,0.00,United States,2021,207770,Finance,Blank Checks
QETA,Quetta Acquisition Corporation Common Stock,$10.18,0.015,0.148%,0.00,United States,2023,1762,,
QETAR,Quetta Acquisition Corporation Right,$1.01,0.00,0.00%,0.00,United States,2023,62,,
QFIN,Qifu Technology Inc. American Depositary Shares,$15.40,0.19,1.249%,2485498893.00,China,2018,752505,Finance,Finance: Consumer Services
QH,Quhuo Limited American Depository Shares,$1.30,-0.06,-4.412%,8017907.00,China,2020,30570,Consumer Discretionary,Business Services
QIPT,Quipt Home Medical Corp. Common Shares,$4.51,0.03,0.67%,189882144.00,United States,,122317,,
QLGN,Qualigen Therapeutics Inc. Common Stock,$0.4901,-0.0168,-3.314%,2539237.00,United States,2015,15414,Health Care,Biotechnology: Pharmaceutical Preparations
QLI,Qilian International Holding Group Ltd. Ordinary Shares,$0.56,-0.04,-6.667%,20020000.00,China,2021,4140,Health Care,Biotechnology: Pharmaceutical Preparations
QLYS,Qualys Inc. Common Stock,$159.47,-4.53,-2.762%,5866177944.00,United States,2012,668984,Technology,EDP Services
QMCO,Quantum Corporation Common Stock,$0.4207,-0.0583,-12.171%,39983584.00,United States,,453264,Technology,Electronic Components
QNCX,Quince Therapeutics Inc. Common Stock,$1.34,-0.01,-0.741%,57444389.00,United States,2019,51197,Health Care,Biotechnology: Biological Products (No Diagnostic Substances)
QNRX,Quoin Pharmaceuticals Ltd. American Depositary Shares,$2.86,0.04,1.418%,2823449.00,Israel,2016,4085,Health Care,Medical/Dental Instruments
QNST,QuinStreet Inc. Common Stock,$15.47,-0.05,-0.322%,849156112.00,United States,2010,507901,Consumer Discretionary,Business Services
QOMO,Qomolangma Acquisition Corp. Common Stock,$10.95,0.02,0.183%,0.00,United States,2022,4589,Finance,Blank Checks
QOMOW,Qomolangma Acquisition Corp. Warrant,$0.02,0.00,0.00%,0.00,United States,2022,100,Finance,Blank Checks
QQQX,Nuveen NASDAQ 100 Dynamic Overwrite Fund Shares of Beneficial Interest,$23.45,0.00,0.00%,0.00,United States,,116429,Finance,Finance Companies
QRHC,Quest Resource Holding Corporation Common Stock,$7.00,-0.02,-0.285%,140419629.00,United States,,11413,Utilities,Environmental Services
QRTEA,Qurate Retail Inc. Series A Common Stock ,$1.22,0.02,1.667%,475064852.00,United States,,5514042,Consumer Discretionary,Catalog/Specialty Distribution
QRTEB,Qurate Retail Inc. Series B Common Stock ,$5.70,-0.23,-3.879%,2219565294.00,United States,,9647,Consumer Discretionary,Catalog/Specialty Distribution
QRTEP,Qurate Retail Inc. 8.0% Fixed Rate Cumulative Redeemable Preferred Stock,$46.44,2.59,5.906%,18083616185.00,United States,,79081,Consumer Discretionary,Catalog/Specialty Distribution
QRVO,Qorvo Inc. Common Stock,$111.89,0.03,0.027%,10802806966.00,United States,,864586,Technology,Semiconductors
QSG,QuantaSing Group Limited American Depositary Shares,$3.53,-0.035,-0.982%,194877717.00,China,2023,107226,Real Estate,Other Consumer Services
QSI,Quantum-Si Incorporated Class A Common Stock,$1.58,-0.02,-1.25%,223930294.00,United States,2020,355689,Health Care,Biotechnology: Pharmaceutical Preparations
QSIAW,Quantum-Si Incorporated Warrant,$0.1903,0.00,0.00%,26970845.00,United States,2020,22,Health Care,Biotechnology: Pharmaceutical Preparations
QTRX,Quanterix Corporation Common Stock,$25.78,-0.29,-1.112%,975250852.00,United States,2017,301068,Industrials,Biotechnology: Laboratory Analytical Instruments
QUBT,Quantum Computing Inc. Common Stock,$0.785,-0.0842,-9.687%,58951340.00,United States,,2137362,Technology,Computer Software: Prepackaged Software
QUIK,QuickLogic Corporation Common Stock,$12.13,-0.73,-5.677%,168729841.00,United States,1999,147955,Technology,Semiconductors
QURE,uniQure N.V. Ordinary Shares,$6.26,0.01,0.16%,299299859.00,Netherlands,2014,648766,Health Care,Biotechnology: Pharmaceutical Preparations
RAIL,FreightCar America Inc. Common Stock,$3.045,0.095,3.22%,54515966.00,United States,2005,41503,Industrials,Railroads
RAND,Rand Capital Corporation Common Stock,$13.50,-0.22,-1.603%,34843784.00,United States,,6469,Finance,Finance/Investors Services
RANI,Rani Therapeutics Holdings Inc. Class A Common Stock,$3.27,-0.01,-0.305%,163488581.00,United States,2021,42690,Health Care, Medicinal Chemicals and Botanical Products 
RAPT,RAPT Therapeutics Inc. Common Stock,$10.18,3.31,48.18%,350153438.00,United States,2019,16228967,Health Care,Biotechnology: Pharmaceutical Preparations
RARE,Ultragenyx Pharmaceutical Inc. Common Stock,$48.18,0.31,0.648%,3956269383.00,United States,2014,456589,Health Care,Biotechnology: Pharmaceutical Preparations
RAVE,Rave Restaurant Group Inc. Common Stock,$1.91,-0.01,-0.521%,27860341.00,United States,,29257,Consumer Discretionary,Restaurants
RAYA,Erayak Power Solution Group Inc. Class A Ordinary Shares,$0.67,-0.039,-5.501%,8341500.00,China,2022,56184,Consumer Discretionary,Metal Fabrications
RBB,RBB Bancorp Common Stock,$17.54,-0.14,-0.792%,333177615.00,United States,2017,23204,Finance,Major Banks
RBBN,Ribbon Communications Inc. Common Stock,$3.14,-0.21,-6.269%,539234577.00,United States,,621148,Technology,EDP Services
RBCAA,Republic Bancorp Inc. Class A Common Stock,$49.94,-0.57,-1.128%,967768033.00,United States,1998,11129,Finance,Major Banks
RBKB,Rhinebeck Bancorp Inc. Common Stock,$8.75,0.05,0.575%,96885311.00,United States,2019,4875,Finance,Major Banks
RCAC,Revelstone Capital Acquisition Corp. Class A Common Stock,$10.70,0.00,0.00%,0.00,United States,2022,783,Finance,Blank Checks
RCAT,Red Cat Holdings Inc. Common Stock,$0.695,-0.0017,-0.244%,51543045.00,United States,,107792,Industrials,Wholesale Distributors
RCEL,Avita Medical Inc. Common Stock,$17.40,-0.18,-1.024%,444582076.00,United States,,151864,Health Care,Medical/Dental Instruments
RCKT,Rocket Pharmaceuticals Inc. Common Stock,$28.54,-0.10,-0.349%,2573134863.00,United States,2015,517480,Health Care,Biotechnology: Pharmaceutical Preparations
RCKTW,Rocket Pharmaceuticals Inc. Warrant,$0.30,0.04,15.385%,,United States,,18267,Health Care,Biotechnology: Pharmaceutical Preparations
RCKY,Rocky Brands Inc. Common Stock,$29.64,-1.00,-3.264%,218678852.00,United States,1993,42307,Consumer Discretionary,Shoe Manufacturing
RCM,R1 RCM Inc. Common Stock,$10.68,-0.09,-0.836%,4478211106.00,United States,,3106393,Consumer Discretionary,Other Consumer Services
RCMT,RCM Technologies Inc. Common Stock,$28.34,0.15,0.532%,221970018.00,United States,,50000,Consumer Discretionary,Professional Services
RCON,Recon Technology Ltd. Class A Ordinary Shares,$0.1652,-0.0054,-3.165%,6695262.00,China,2009,200367,Energy,Oilfield Services/Equipment
RCRT,Recruiter.com Group Inc. Common Stock,$1.935,0.085,4.595%,2774602.00,United States,,30449,Technology,EDP Services
RCRTW,Recruiter.com Group Inc. Warrant,$0.02,0.0001,0.503%,28678.00,United States,,3133,Technology,EDP Services
RDCM,Radcom Ltd. Ordinary Shares,$9.80,-0.18,-1.804%,146902000.00,Israel,1997,18521,Technology,Computer peripheral equipment
RDFN,Redfin Corporation Common Stock,$6.69,-0.27,-3.879%,770966558.00,United States,2017,4141701,Finance,Real Estate
RDHL,Redhill Biopharma Ltd. American Depositary Shares,$0.5523,0.0251,4.761%,16404982.00,Israel,,487495,Health Care,Biotechnology: Pharmaceutical Preparations
RDI,Reading International Inc Class A Common Stock,$1.93,-0.02,-1.026%,39744170.00,United States,,8960,Consumer Discretionary,Movies/Entertainment
RDIB,Reading International Inc Class B Common Stock,$15.449,0.00,0.00%,25963435.00,United States,,101,Consumer Discretionary,Movies/Entertainment
RDNT,RadNet Inc. Common Stock,$38.51,0.80,2.121%,2614625090.00,United States,,315072,Health Care,Medical Specialities
RDUS,Radius Recycling Inc. Class A Common Stock,$23.79,-0.37,-1.531%,662829486.00,United States,,132412,Consumer Discretionary,Industrial Specialties
RDVT,Red Violet Inc. Common Stock ,$17.90,0.12,0.675%,249515350.00,United States,,9408,Technology,Computer Software: Prepackaged Software
RDWR,Radware Ltd. Ordinary Shares,$17.26,-0.45,-2.541%,756331474.00,Israel,1999,205604,Consumer Discretionary,Business Services
RDZN,Roadzen Inc. Ordinary Shares,$6.68,0.29,4.538%,457184738.00,United States,2022,1790,Finance,Blank Checks
REAL,The RealReal Inc. Common Stock,$1.69,-0.09,-5.056%,174666766.00,United States,2019,3612170,Consumer Discretionary,Consumer Specialties
REAX,The Real Brokerage Inc. Common Shares,$2.89,0.01,0.347%,525402000.00,Canada,,131540,Finance,Real Estate
REBN,Reborn Coffee Inc. Common Stock,$1.74,-0.05,-2.793%,4697231.00,United States,2022,20596,Consumer Discretionary,Restaurants
REE,REE Automotive Ltd. Class A Ordinary Shares,$7.28,-0.65,-8.197%,81237411.00,Israel,,24974,Consumer Discretionary,Auto Manufacturing
REFI,Chicago Atlantic Real Estate Finance Inc. Common Stock,$15.96,-0.04,-0.25%,290188566.00,United States,2021,69105,Real Estate,Real Estate Investment Trusts
REFR,Research Frontiers Incorporated Common Stock,$0.9999,-0.0201,-1.971%,33505936.00,United States,,48915,Miscellaneous,Multi-Sector Companies
REG,Regency Centers Corporation Common Stock,$61.22,0.60,0.99%,11299899076.00,United States,1993,819230,Real Estate,Real Estate Investment Trusts
REGCO,Regency Centers Corporation 5.875% Series B Cumulative Redeemable Preferred Stock,$24.12,0.00,0.00%,4452034722.00,United States,,1208,,
REGCP,Regency Centers Corporation 6.25% Series A Cumulative Redeemable Preferred Stock,$24.35,-0.10,-0.409%,4494487790.00,United States,,2301,,
REGN,Regeneron Pharmaceuticals Inc. Common Stock,$952.84,5.97,0.63%,104585524985.00,United States,1991,300492,Health Care,Biotechnology: Pharmaceutical Preparations
REKR,Rekor Systems Inc. Common Stock,$2.29,-0.07,-2.966%,158346843.00,United States,,843702,Telecommunications,Telecommunications Equipment
RELI,Reliance Global Group Inc. Common Stock,$0.46,-0.015,-3.158%,2193677.00,United States,,29608,Finance,Specialty Insurers
RELL,Richardson Electronics Ltd. Common Stock,$8.79,-0.15,-1.678%,125507496.00,United States,1983,132054,Technology,Electronic Components
RELY,Remitly Global Inc. Common Stock,$17.69,-0.31,-1.722%,3275440438.00,United States,2021,1878340,Technology,Computer Software: Prepackaged Software
RENB,Renovaro Inc. Common Stock,$2.12,0.10,4.95%,304576949.00,United States,,132292,Health Care,Biotechnology: Pharmaceutical Preparations
RENE,Cartesian Growth Corporation II Class A Ordinary Shares,$11.05,0.00,0.00%,0.00,United States,2022,7445,Finance,Blank Checks
RENT,Rent the Runway Inc. Class A Common Stock,$0.441,-0.029,-6.17%,31271582.00,United States,2021,1292822,Consumer Discretionary,Other Specialty Stores
REPL,Replimune Group Inc. Common Stock,$7.64,-0.01,-0.131%,469002685.00,United States,2018,1780866,Health Care,Biotechnology: Biological Products (No Diagnostic Substances)
RETO,ReTo Eco-Solutions Inc. Common Shares,$0.3738,-0.0212,-5.367%,2011044.00,China,2017,108272,Industrials,Industrial Machinery/Components
REVB,Revelation Biosciences Inc. Common Stock,$3.15,0.32,11.307%,661220.00,United States,2020,1624502,Health Care,Biotechnology: Pharmaceutical Preparations
REVBW,Revelation Biosciences Inc. Warrant,$0.009,0.00,0.00%,1889.00,United States,2020,63894,Health Care,Biotechnology: Pharmaceutical Preparations
REYN,Reynolds Consumer Products Inc. Common Stock,$29.39,0.20,0.685%,6172178059.00,United States,2020,517743,Industrials,Office Equipment/Supplies/Services
RFAC,RF Acquisition Corp. Class A Common Stock,$10.80,0.0199,0.185%,0.00,Singapore,2022,2603,Finance,Blank Checks
RFIL,RF Industries Ltd. Common Stock,$3.3701,0.0201,0.60%,34857696.00,United States,,4803,Technology,Electrical Products
RGC,Regencell Bioscience Holdings Limited Ordinary Shares,$7.79,0.00,0.00%,101370226.00,Hong Kong,2021,69,Health Care, Medicinal Chemicals and Botanical Products 
RGCO,RGC Resources Inc. Common Stock,$18.83,-0.02,-0.106%,191376728.00,United States,,8698,Utilities,Oil & Gas Production
RGEN,Repligen Corporation Common Stock,$194.10,-5.63,-2.819%,10836993723.00,United States,1986,1263231,Health Care,Biotechnology: Biological Products (No Diagnostic Substances)
RGF,The Real Good Food Company Inc. Class A Common Stock,$1.22,-0.03,-2.40%,41094729.00,United States,2021,55175,Consumer Staples,Packaged Foods
RGLD,Royal Gold Inc. Common Stock,$106.49,-0.73,-0.681%,6995584954.00,United States,,430034,Industrials,Precious Metals
RGLS,Regulus Therapeutics Inc. Common Stock,$1.51,-0.035,-2.265%,30536235.00,United States,2012,15288,Health Care,Biotechnology: Pharmaceutical Preparations
RGNX,REGENXBIO Inc. Common Stock,$18.40,-0.14,-0.755%,809452432.00,United States,2015,340322,Health Care,Biotechnology: Biological Products (No Diagnostic Substances)
RGP,Resources Connection Inc. Common Stock,$13.25,0.13,0.991%,443983716.00,United States,,207814,Consumer Discretionary,Business Services
RGS,Regis Corporation Common Stock,$10.05,-0.1707,-1.67%,22908473.00,United States,1991,3844,Consumer Discretionary,Other Consumer Services
RGTI,Rigetti Computing Inc. Common Stock,$1.52,-0.12,-7.317%,222902730.00,United States,,6016846,Technology,Retail: Computer Software & Peripheral Equipment
RGTIW,Rigetti Computing Inc. Warrants,$0.2899,0.0099,3.536%,42512830.00,United States,,13882,Technology,Retail: Computer Software & Peripheral Equipment
RICK,RCI Hospitality Holdings Inc. Common Stock,$55.86,-0.55,-0.975%,522832004.00,United States,1995,42871,Consumer Discretionary,Restaurants
RIGL,Rigel Pharmaceuticals Inc. Common Stock,$1.12,-0.02,-1.754%,195293843.00,United States,2000,408564,Health Care,Biotechnology: Pharmaceutical Preparations
RILY,B. Riley Financial Inc. Common Stock,$15.20,-0.80,-5.00%,464859639.00,United States,,1557710,Finance,Investment Managers
RILYG,B. Riley Financial Inc. 5.00% Senior Notes due 2026,$13.88,-0.32,-2.254%,424490249.00,United States,,105898,Finance,Investment Managers
RILYK,B. Riley Financial Inc. 5.50% Senior Notes Due 2026,$16.75,-0.2001,-1.181%,512263089.00,United States,,44652,Finance,Investment Managers
RILYL,B. Riley Financial Inc. Depositary Shares each representing 1/1000th in a share of 7.375% Series B Cumulative Perpetual Preferred Stock par value $0.0001,$15.55,-0.94,-5.70%,475563644.00,United States,,21595,Finance,Investment Managers
RILYM,B. Riley Financial Inc. 6.375% Senior Notes due 2025,$19.22,-0.48,-2.437%,587802781.00,United States,,218933,Finance,Investment Managers
RILYN,B. Riley Financial Inc. 6.50% Senior Notes Due 2026,$13.95,-0.96,-6.439%,426631050.00,United States,,164900,Finance,Investment Managers
RILYO,B. Riley Financial Inc. 6.75% Senior Notes due 2024,$25.00,0.068,0.273%,764571775.00,United States,,37074,Finance,Investment Managers
RILYP,B. Riley Financial Inc. Depositary Shares each representing a 1/1000th fractional interest in a share of Series A Cumulative Perpetual Preferred Stock,$13.26,0.05,0.379%,405528869.00,United States,,71744,Finance,Investment Managers
RILYT,B. Riley Financial Inc. 6.00% Senior Notes Due 2028,$11.9006,-0.9994,-7.747%,363954515.00,United States,,176897,Finance,Investment Managers
RILYZ,B. Riley Financial Inc. 5.25% Senior Notes due 2028,$10.70,-0.99,-8.469%,327236720.00,United States,,406163,Finance,Investment Managers
RIOT,Riot Platforms Inc. Common Stock ,$15.10,-0.94,-5.86%,3118382767.00,United States,,13866262,Finance,Finance: Consumer Services
RIVN,Rivian Automotive Inc. Class A Common Stock,$15.39,-0.50,-3.147%,14739273741.00,United States,2021,52420991,Consumer Discretionary,Auto Manufacturing
RKDA,Arcadia Biosciences Inc. Common Stock,$3.04,-0.028,-0.913%,3375424.00,United States,2015,7516,Industrials,Agricultural Chemicals
RKLB,Rocket Lab USA Inc. Common Stock,$4.64,-0.19,-3.934%,2254515648.00,United States,2020,5457639,Industrials,Aerospace
RLAY,Relay Therapeutics Inc. Common Stock,$10.48,-0.23,-2.148%,1291856395.00,United States,2020,661312,Health Care,Biotechnology: Biological Products (No Diagnostic Substances)
RLMD,Relmada Therapeutics Inc. Common Stock,$5.69,-0.27,-4.53%,171264465.00,United States,,223398,Health Care,Biotechnology: Pharmaceutical Preparations
RLYB,Rallybio Corporation Common Stock,$1.80,-0.03,-1.639%,68028669.00,United States,2021,158310,Health Care,Biotechnology: Pharmaceutical Preparations
RMBI,Richmond Mutual Bancorporation Inc. Common Stock,$11.03,-0.11,-0.987%,124028699.00,United States,2019,2846,,
RMBL,RumbleOn Inc. Class B Common Stock,$7.02,-0.54,-7.143%,118352279.00,United States,,68729,Technology,EDP Services
RMBS,Rambus Inc. Common Stock,$56.31,1.25,2.27%,6053845361.00,United States,1997,1361616,Technology,Semiconductors
RMCF,Rocky Mountain Chocolate Factory Inc. Common Stock,$4.35,0.13,3.081%,27471377.00,United States,,10074,Consumer Staples,Specialty Foods
RMCO,Royalty Management Holding Corporation Class A Common Stock,$1.31,-0.08,-5.755%,0.00,United States,2023,46169,Miscellaneous,Multi-Sector Companies
RMCOW,Royalty Management Holding Corporation Warrant,$0.0393,-0.0154,-28.154%,0.00,United States,2023,6252,Miscellaneous,Multi-Sector Companies
RMGC,RMG Acquisition Corp. III Class A Ordinary Shares,$10.03,-0.01,-0.10%,0.00,United States,2021,1373,Finance,Blank Checks
RMGCU,RMG Acquisition Corp. III Unit,$9.9201,0.00,0.00%,0.00,United States,2021,50,Finance,Blank Checks
RMNI,Rimini Street Inc. (DE) Common Stock,$3.01,-0.08,-2.589%,269060890.00,United States,2015,189749,Consumer Discretionary,Business Services
RMR,The RMR Group Inc. Class A Common Stock,$24.26,-0.14,-0.574%,769253620.00,United States,,96910,Finance,Real Estate
RMTI,Rockwell Medical Inc. Common Stock,$1.33,-0.01,-0.746%,37891252.00,United States,1998,202017,Health Care,Biotechnology: Pharmaceutical Preparations
RNA,Avidity Biosciences Inc. Common Stock,$14.39,0.41,2.933%,1066317045.00,United States,2020,730769,Health Care,Biotechnology: Pharmaceutical Preparations
RNAC,Cartesian Therapeutics Inc. Common Stock,$0.7216,-0.0203,-2.736%,116847116.00,United States,2016,241255,Health Care,Biotechnology: Pharmaceutical Preparations
RNAZ,TransCode Therapeutics Inc. Common Stock,$0.67,-0.009,-1.325%,420385.00,United States,2021,260596,Health Care,Biotechnology: Pharmaceutical Preparations
RNLX,Renalytix plc American Depositary Shares,$0.6756,-0.0744,-9.92%,33756407.00,United Kingdom,2020,207244,Health Care,Medical Specialities
RNW,ReNew Energy Global plc Class A Ordinary Shares,$6.25,-0.06,-0.951%,503178875.00,United Kingdom,,430714,Industrials,Environmental Services
RNWWW,ReNew Energy Global plc Warrant,$0.697,-0.023,-3.194%,56114508.00,United Kingdom,,11246,Utilities,Electric Utilities: Central
RNXT,RenovoRx Inc. Common Stock,$1.36,-0.02,-1.449%,14543269.00,United States,2021,14881,Health Care,Biotechnology: Pharmaceutical Preparations
ROAD,Construction Partners Inc. Class A Common Stock,$46.03,0.33,0.722%,2431643657.00,United States,2018,306102,Industrials,Military/Government/Technical
ROCK,Gibraltar Industries Inc. Common Stock,$74.02,-11.17,-13.112%,2252905141.00,United States,1993,530857,,
ROCL,Roth CH Acquisition V Co. Common Stock,$10.80,0.09,0.84%,0.00,United States,2022,301,Finance,Blank Checks
ROCLW,Roth CH Acquisition V Co. Warrant,$0.0815,0.0027,3.426%,0.00,United States,2022,150,Finance,Blank Checks
ROI,RiskOn International Inc. Common Stock,$0.12,-0.007,-5.512%,3916177.00,United States,,1877788,Energy,Oil & Gas Production
ROIC,Retail Opportunity Investments Corp. Common Stock (MD),$13.09,0.32,2.506%,1662493199.00,United States,,1846712,Real Estate,Real Estate Investment Trusts
ROIV,Roivant Sciences Ltd. Common Shares,$11.54,0.00,0.00%,9299462909.00,United Kingdom,,3735598,Health Care,Biotechnology: Pharmaceutical Preparations
ROKU,Roku Inc. Class A Common Stock,$63.90,-3.35,-4.981%,9171051710.00,United States,2017,12825267,Telecommunications,Cable & Other Pay Television Services
ROMA,Roma Green Finance Limited Ordinary Shares,$1.53,0.13,9.286%,15950694.00,Hong Kong,2024,1368884,Finance,Savings Institutions
ROOT,Root Inc. Class A Common Stock,$8.67,-0.40,-4.41%,126582000.00,United States,2020,98941,Finance,Property-Casualty Insurers
ROP,Roper Technologies Inc. Common Stock,$549.02,4.91,0.902%,58647478675.00,United States,1992,381166,Industrials,Industrial Machinery/Components
ROST,Ross Stores Inc. Common Stock,$144.82,0.37,0.256%,48756008642.00,United States,1985,1484056,Consumer Discretionary,Clothing/Shoe/Accessory Stores
ROVR,Rover Group Inc. Class A Common Stock,$10.97,-0.01,-0.091%,1968370323.00,United States,2021,1185337,Consumer Discretionary,Other Consumer Services
RPAY,Repay Holdings Corporation Class A Common Stock,$8.16,0.09,1.115%,772417277.00,United States,2018,602668,Consumer Discretionary,Business Services
RPD,Rapid7 Inc. Common Stock,$54.27,-4.64,-7.876%,3334727225.00,United States,2015,1655765,Technology,Computer Software: Prepackaged Software
RPHM,Reneo Pharmaceuticals Inc. Common Stock,$1.62,-0.02,-1.22%,53965095.00,United States,2021,377990,Health Care,Biotechnology: Pharmaceutical Preparations
RPID,Rapid Micro Biosystems Inc. Class A Common Stock,$0.94,0.01,1.075%,39854971.00,United States,2021,18550,Health Care,Medical Specialities
RPRX,Royalty Pharma plc Class A Ordinary Shares ,$31.23,0.93,3.069%,18657888523.00,United States,2020,6577891,Health Care,Biotechnology: Pharmaceutical Preparations
RPTX,Repare Therapeutics Inc. Common Shares,$6.15,-0.13,-2.07%,259097354.00,Canada,2020,85634,Health Care,Biotechnology: Pharmaceutical Preparations
RR,Richtech Robotics Inc. Class B Common Stock,$1.58,-0.15,-8.671%,0.00,United States,2023,300464,,
RRBI,Red River Bancshares Inc. Common Stock,$49.68,-0.67,-1.331%,354306135.00,United States,2019,4072,Consumer Discretionary,Hotels/Resorts
RRGB,Red Robin Gourmet Burgers Inc. Common Stock,$8.65,-0.53,-5.773%,133902000.00,United States,2002,670998,Consumer Discretionary,Restaurants
RRR,Red Rock Resorts Inc. Class A Common Stock,$57.60,0.62,1.088%,6012550253.00,United States,2016,467610,Consumer Discretionary,Hotels/Resorts
RSLS,ReShape Lifesciences Inc. Common Stock,$0.1667,0.001,0.604%,3910290.00,United States,2016,301685,Health Care,Medical/Dental Instruments
RSSS,Research Solutions Inc Common Stock,$2.83,-0.13,-4.392%,92316035.00,United States,,35121,Consumer Discretionary,Business Services
RSVR,Reservoir Media Inc. Common Stock,$7.03,0.03,0.429%,455700488.00,United States,2021,59703,Consumer Discretionary,Movies/Entertainment
RSVRW,Reservoir Media Inc. Warrant,$0.93,-0.11,-10.577%,60284702.00,United States,2021,10678,Consumer Discretionary,Movies/Entertainment
RTC,Baijiayun Group Ltd. Class A Ordinary Shares,$0.72,0.004,0.559%,68471117.00,China,2006,229112,Technology,Computer Software: Prepackaged Software
RUM,Rumble Inc. Class A Common Stock,$7.20,0.15,2.128%,2779597130.00,United States,2021,2619392,Technology,Computer Software: Prepackaged Software
RUMBW,Rumble Inc. Warrant,$2.09,0.00,0.00%,806855278.00,United States,2021,10828,Technology,Computer Software: Prepackaged Software
RUN,Sunrun Inc. Common Stock,$15.58,-0.31,-1.951%,3394553231.00,United States,2015,11098207,Miscellaneous,Industrial Machinery/Components
RUSHA,Rush Enterprises Inc. Common Stock Cl A,$45.54,0.81,1.811%,2805237222.00,United States,,311015,Consumer Discretionary,Other Specialty Stores
RUSHB,Rush Enterprises Inc. Class B,$47.84,0.56,1.184%,855902617.00,United States,,24868,Consumer Discretionary,Other Specialty Stores
RVMD,Revolution Medicines Inc. Common Stock,$29.17,0.00,0.00%,3196002153.00,United States,2020,809267,Health Care,Biotechnology: Biological Products (No Diagnostic Substances)
RVMDW,Revolution Medicines Inc. Warrant,$0.21,0.02,10.526%,23008586.00,United States,,472,,
RVNC,Revance Therapeutics Inc. Common Stock,$5.37,-0.14,-2.541%,471558388.00,United States,2014,962457,Health Care,Biotechnology: Pharmaceutical Preparations
RVPH,Reviva Pharmaceuticals Holdings Inc. Common Stock ,$4.25,-0.14,-3.189%,96263631.00,United States,2020,112960,Health Care,Biotechnology: Pharmaceutical Preparations
RVPHW,Reviva Pharmaceuticals Holdings Inc. Warrants,$1.00,0.05,5.263%,22650266.00,United States,2018,6439,Health Care,Biotechnology: Pharmaceutical Preparations
RVSB,Riverview Bancorp Inc Common Stock,$4.66,-0.08,-1.688%,98377460.00,United States,,32366,Finance,Savings Institutions
RVSN,Rail Vision Ltd. Ordinary Share,$3.84,-0.56,-12.727%,11513388.00,Israel,2022,491275,,
RVSNW,Rail Vision Ltd. Warrant,$0.1202,-0.0094,-7.253%,360393.00,Israel,2022,11380,,
RVYL,Ryvyl Inc. Common Stock,$4.06,-0.37,-8.352%,21867732.00,United States,,13225,Consumer Discretionary,Professional Services
RWAY,Runway Growth Finance Corp. Common Stock,$13.31,-0.13,-0.967%,539178370.00,United States,2021,141481,,
