Symbol,Name,Last Sale,Net Change,% Change,Market Cap,Country,IPO Year,Volume,Sector,Industry
CPTN,Cepton Inc. Common Stock,$2.645,-0.025,-0.936%,41915143.00,United States,2021,5110,Industrials,Industrial Machinery/Components
CPTNW,Cepton Inc. Warrant,$0.01,-0.0004,-3.846%,158469.00,United States,2021,124611,Industrials,Industrial Machinery/Components
CPZ,Calamos Long/Short Equity & Dynamic Income Trust Common Stock,$14.90,-0.05,-0.334%,292519691.00,United States,2019,32559,Finance,Trusts Except Educational Religious and Charitable
CRAI,CRA International Inc. Common Stock,$110.63,-0.55,-0.495%,774599841.00,United States,1998,18487,Consumer Discretionary,Other Consumer Services
CRBP,Corbus Pharmaceuticals Holdings Inc. Common Stock,$27.15,3.85,16.524%,120102993.00,United States,,816568,Health Care,Biotechnology: Pharmaceutical Preparations
CRBU,Caribou Biosciences Inc. Common Stock,$6.84,0.03,0.441%,604868970.00,United States,2021,713709,Health Care, Medicinal Chemicals and Botanical Products 
CRCT,Cricut Inc. Class A Common Stock,$4.98,-0.22,-4.231%,1091451765.00,United States,2021,2221628,Industrials,Wholesale Distributors
CRDF,Cardiff Oncology Inc. Common Stock,$1.68,-0.02,-1.176%,75057644.00,United States,,86137,Health Care,Biotechnology: Biological Products (No Diagnostic Substances)
CRDL,Cardiol Therapeutics Inc. Class A Common Shares,$1.47,-0.20,-11.976%,95717501.00,Canada,,579476,Health Care,Biotechnology: Biological Products (No Diagnostic Substances)
CRDO,Credo Technology Group Holding Ltd Ordinary Shares,$21.97,0.56,2.616%,3309985832.00,United States,2022,2388868,Technology,Semiconductors
CREG,Smart Powerr Corp. Common Stock,$1.53,-0.03,-1.923%,12184069.00,China,,35795,Consumer Discretionary,Business Services
CRESW,Cresud S.A.C.I.F. y A. Warrant,$0.50,-0.0001,-0.02%,299651320.00,Argentina,,157,Finance,Real Estate
CRESY,Cresud S.A.C.I.F. y A. American Depositary Shares,$8.27,-0.13,-1.548%,495623283.00,Argentina,1997,147120,Finance,Real Estate
CREV,Carbon Revolution Public Limited Ordinary Shares,$12.32,0.77,6.667%,23102267.00,Ireland,,8836,,
CREVW,Carbon Revolution Public Limited Company Warrant,$0.0685,-0.0001,-0.146%,128450.00,Ireland,,1253,,
CREX,Creative Realities Inc. Common Stock,$3.80,-0.05,-1.299%,39554303.00,United States,,109992,Technology,EDP Services
CRGE,Charge Enterprises Inc. Common Stock,$0.08,-0.005,-5.882%,17203189.00,United States,,8675225,Consumer Discretionary,Telecommunications Equipment
CRGO,Freightos Limited Ordinary shares,$2.85,-0.055,-1.893%,135204000.00,Israel,,4105,Finance,Blank Checks
CRGX,CARGO Therapeutics Inc. Common Stock,$21.83,-1.63,-6.948%,899508250.00,United States,2023,370448,,
CRIS,Curis Inc. Common Stock,$10.27,0.13,1.282%,60532253.00,United States,,32839,Health Care,Biotechnology: Biological Products (No Diagnostic Substances)
CRKN,Crown Electrokinetics Corp. Common Stock,$0.10,-0.0019,-1.865%,1263656.00,United States,,6411733,Technology,Industrial Machinery/Components
CRMD,CorMedix Inc. Common Stock,$3.25,-0.04,-1.216%,178139137.00,United States,,157061,Health Care,Biotechnology: Pharmaceutical Preparations
CRMT,America's Car-Mart Inc Common Stock,$64.38,2.20,3.538%,411570910.00,United States,,67720,Consumer Discretionary,Retail-Auto Dealers and Gas Stations
CRNC,Cerence Inc. Common Stock,$14.72,-0.71,-4.601%,613450657.00,United States,,597171,Technology,Computer Software: Prepackaged Software
CRNT,Ceragon Networks Ltd. Ordinary Shares,$2.92,0.15,5.415%,246331200.00,Israel,,1636002,Technology,Radio And Television Broadcasting And Communications Equipment
CRNX,Crinetics Pharmaceuticals Inc. Common Stock,$36.40,-1.02,-2.726%,2431492955.00,United States,2018,385249,Health Care,Biotechnology: Pharmaceutical Preparations
CRON,Cronos Group Inc. Common Share,$2.19,-0.02,-0.905%,834638705.00,Canada,,1957371,Health Care, Medicinal Chemicals and Botanical Products 
CROX,Crocs Inc. Common Stock,$115.72,0.13,0.112%,7000889892.00,United States,2006,861231,Consumer Discretionary,Shoe Manufacturing
CRSP,CRISPR Therapeutics AG Common Shares,$82.41,3.68,4.674%,6546027875.00,Switzerland,2016,3131414,Health Care,Biotechnology: Biological Products (No Diagnostic Substances)
CRSR,Corsair Gaming Inc. Common Stock,$13.40,-0.13,-0.961%,1379912825.00,United States,2020,431010,Technology,Computer Manufacturing
CRTO,Criteo S.A. American Depositary Shares,$31.46,0.33,1.06%,1774985218.00,France,2013,380059,Consumer Discretionary,Advertising
CRUS,Cirrus Logic Inc. Common Stock,$90.37,0.39,0.433%,4874104504.00,United States,1989,431449,Technology,Semiconductors
CRVL,CorVel Corp. Common Stock,$260.89,10.57,4.223%,4459725927.00,United States,,86428,Finance,Specialty Insurers
CRVO,CervoMed Inc. Common Stock,$14.50,-1.15,-7.348%,82280540.00,United States,,33966,Health Care,Biotechnology: Pharmaceutical Preparations
CRVS,Corvus Pharmaceuticals Inc. Common Stock,$2.30,-0.02,-0.862%,112788739.00,United States,2016,67026,Health Care,Biotechnology: Pharmaceutical Preparations
CRWD,CrowdStrike Holdings Inc. Class A Common Stock,$292.36,-31.35,-9.685%,70208736067.00,United States,2019,9067401,Technology,Computer Software: Prepackaged Software
CRWS,Crown Crafts Inc Common Stock,$5.41,-0.09,-1.636%,55402290.00,United States,,8639,Consumer Discretionary,Textiles
CSBR,Champions Oncology Inc. Common Stock,$5.67,-0.30,-5.025%,77076659.00,United States,,1613,Health Care,Biotechnology: Biological Products (No Diagnostic Substances)
CSCO,Cisco Systems Inc. Common Stock (DE),$48.48,0.20,0.414%,196304589638.00,United States,1990,15999174,Telecommunications,Computer Communications Equipment
CSGP,CoStar Group Inc. Common Stock,$83.98,2.74,3.373%,34294355645.00,United States,1998,5361723,Finance,Real Estate
CSGS,CSG Systems International Inc. Common Stock,$53.06,0.98,1.882%,1574348831.00,United States,1996,177733,Technology,EDP Services
CSIQ,Canadian Solar Inc. Common Shares (ON),$22.33,-0.51,-2.233%,1443411200.00,Canada,2006,615832,Technology,Semiconductors
CSLM,CSLM Acquisition Corp. Class A Ordinary Share,$10.95,0.00,0.00%,0.00,United States,2022,12003,Finance,Blank Checks
CSLR,Complete Solaria Inc. Common Stock,$1.20,-0.04,-3.226%,51811892.00,United States,,2771,Technology,Semiconductors
CSPI,CSP Inc. Common Stock,$33.71,3.91,13.121%,163727785.00,United States,1982,125941,Technology,EDP Services
CSQ,Calamos Strategic Total Return Common Stock,$15.64,0.04,0.256%,2485002408.00,United States,2004,252450,Finance,Finance Companies
CSSE,Chicken Soup for the Soul Entertainment Inc. Class A Common Stock,$0.212,0.002,0.952%,6829752.00,United States,2017,192651,Consumer Discretionary,Movies/Entertainment
CSSEL,Chicken Soup for the Soul Entertainment Inc. Warrant,$0.0083,0.0001,1.22%,267391.00,United States,,21668,Consumer Discretionary,Movies/Entertainment
CSSEN,Chicken Soup for the Soul Entertainment Inc. 9.50% Notes due 2025,$3.43,0.16,4.893%,110500239.00,United States,,2939,Consumer Discretionary,Movies/Entertainment
CSSEP,Chicken Soup for the Soul Entertainment Inc. 9.75% Series A Cumulative Redeemable Perpetual Preferred Stock,$1.01,0.00,0.00%,32537971.00,United States,,16763,Consumer Discretionary,Movies/Entertainment
CSTE,Caesarstone Ltd. Ordinary Shares,$4.10,0.18,4.592%,141491000.00,Israel,2012,41309,Consumer Discretionary,Multi-Sector Companies
CSTL,Castle Biosciences Inc. Common Stock,$24.69,-0.40,-1.594%,664421430.00,United States,2019,288162,Health Care,Medical Specialities
CSTR,CapStar Financial Holdings Inc. Common Stock,$18.53,0.51,2.83%,383792786.00,United States,2016,247382,Finance,Major Banks
CSWC,Capital Southwest Corporation Common Stock,$23.39,-0.34,-1.433%,1005328841.00,United States,,344778,Consumer Discretionary,Textiles
CSWCZ,Capital Southwest Corporation 7.75% Notes due 2028,$25.6235,0.0168,0.066%,1101327215.00,United States,,3667,Finance,Finance Companies
CSWI,CSW Industrials Inc. Common Stock,$227.00,-6.39,-2.738%,3525871144.00,United States,,105260,Industrials,Home Furnishings
CSX,CSX Corporation Common Stock,$37.10,0.24,0.651%,72683884088.00,United States,,10010096,Industrials,Railroads
CTAS,Cintas Corporation Common Stock,$618.66,4.02,0.654%,62714451977.00,United States,1983,309009,Consumer Discretionary,Business Services
CTBI,Community Trust Bancorp Inc. Common Stock,$40.69,-0.31,-0.756%,732413490.00,United States,,44643,Finance,Major Banks
CTCX,Carmell Corporation Common Stock,$3.2801,0.2701,8.973%,75710094.00,United States,2021,2033,Health Care,Medical/Dental Instruments
CTCXW,Carmell Corporation Warrant,$0.19,0.00,0.00%,4385512.00,United States,2021,10,Health Care,Medical/Dental Instruments
CTHR,Charles & Colvard Ltd Common Stock,$0.316,-0.025,-7.331%,9589006.00,United States,1997,112287,Consumer Discretionary,Consumer Specialties
CTKB,Cytek Biosciences Inc. Common Stock,$8.45,0.07,0.835%,1145390351.00,United States,2021,419710,Health Care,Biotechnology: Electromedical & Electrotherapeutic Apparatus
CTLP,Cantaloupe Inc. Common Stock,$6.28,-0.32,-4.848%,457165304.00,United States,,484359,Technology,EDP Services
CTMX,CytomX Therapeutics Inc. Common Stock,$1.45,-0.02,-1.361%,97133911.00,United States,2015,81048,Health Care,Biotechnology: Pharmaceutical Preparations
CTNT,Cheetah Net Supply Chain Service Inc. Class A Common Stock,$1.91,-0.04,-2.051%,34219560.00,United States,2023,12924,,
CTRM,Castor Maritime Inc. Common Shares,$0.4096,-0.0064,-1.538%,38752256.00,Cyprus,,361371,Consumer Discretionary,Marine Transportation
CTRN,Citi Trends Inc. Common Stock,$28.23,-0.34,-1.19%,241206859.00,United States,2005,26269,Consumer Discretionary,Clothing/Shoe/Accessory Stores
CTSH,Cognizant Technology Solutions Corporation Class A Common Stock,$77.47,0.73,0.951%,38567822219.00,United States,1998,3507726,Technology,EDP Services
CTSO,Cytosorbents Corporation Common Stock,$1.00,-0.02,-1.961%,44438509.00,United States,,136908,Health Care,Medical/Dental Instruments
CTXR,Citius Pharmaceuticals Inc. Common Stock,$0.7699,0.0199,2.653%,122487072.00,United States,,389850,Health Care,Biotechnology: Pharmaceutical Preparations
CUBA,Herzfeld Caribbean Basin Fund Inc. (The) Common Stock,$2.61,0.05,1.953%,0.00,United States,,30434,Finance,Investment Managers
CUE,Cue Biopharma Inc. Common Stock,$2.08,0.00,0.00%,93856424.00,United States,2018,142643,Health Care,Biotechnology: Pharmaceutical Preparations
CULL,Cullman Bancorp Inc. Common Stock,$10.6699,0.0399,0.375%,77427847.00,United States,2021,774,Finance,Savings Institutions
CURI,CuriosityStream Inc. Class A Common Stock,$0.46,-0.03,-6.122%,24414938.00,United States,2020,118897,Consumer Discretionary,Movies/Entertainment
CUTR,Cutera Inc. Common Stock,$2.71,-0.22,-7.509%,54047901.00,United States,2004,896219,Health Care,Biotechnology: Electromedical & Electrotherapeutic Apparatus
CVAC,CureVac N.V. Ordinary Shares,$3.42,-0.05,-1.441%,765538272.00,Germany,2020,711646,Health Care,Biotechnology: Pharmaceutical Preparations
CVBF,CVB Financial Corporation Common Stock,$17.25,-0.11,-0.634%,2403578672.00,United States,,723025,Finance,Major Banks
CVCO,Cavco Industries Inc. Common Stock When Issued,$365.22,-2.59,-0.704%,3048351826.00,United States,,58485,Consumer Discretionary,Homebuilding
CVCY,Central Valley Community Bancorp Common Stock,$17.94,0.04,0.223%,211959001.00,United States,,20928,Finance,Major Banks
CVGI,Commercial Vehicle Group Inc. Common Stock,$6.77,0.10,1.499%,228196864.00,United States,2004,90254,Consumer Discretionary,Auto Parts:O.E.M.
CVGW,Calavo Growers Inc. Common Stock,$28.18,-0.27,-0.949%,501565112.00,United States,,107932,Consumer Discretionary,Specialty Foods
CVII,Churchill Capital Corp VII Class A Common Stock,$10.63,0.00,0.00%,0.00,United States,,3996,Finance,Blank Checks
CVIIW,Churchill Capital Corp VII Warrants,$0.3398,-0.0002,-0.059%,,United States,,42600,Finance,Blank Checks
CVKD,Cadrenal Therapeutics Inc. Common Stock,$0.738,0.0066,0.902%,9610792.00,United States,2023,100076,Health Care, Medicinal Chemicals and Botanical Products 
CVLG,Covenant Logistics Group Inc. Class A Common Stock,$51.85,0.34,0.66%,671288210.00,United States,,72097,Industrials,Trucking Freight/Courier Services
CVLT,Commvault Systems Inc. Common Stock,$92.39,0.07,0.076%,4033897164.00,United States,2006,461612,Technology,Computer Software: Prepackaged Software
CVLY,Codorus Valley Bancorp Inc Common Stock,$23.03,-0.08,-0.346%,221343863.00,United States,,12044,Finance,Savings Institutions
CVRX,CVRx Inc. Common Stock,$21.92,-0.32,-1.439%,458735820.00,United States,2021,107917,Health Care,Biotechnology: Electromedical & Electrotherapeutic Apparatus
CVV,CVD Equipment Corporation Common Stock,$4.7899,-0.0101,-0.21%,32688725.00,United States,,9448,Technology,Industrial Machinery/Components
CWBC,Community West Bancshares Common Stock,$14.24,0.00,0.00%,126028443.00,United States,,35148,Finance,Major Banks
CWCO,Consolidated Water Co. Ltd. Ordinary Shares,$30.13,-0.04,-0.133%,474471090.00,Cayman Islands,,104598,Utilities,Water Supply
CWD,CaliberCos Inc. Class A Common Stock,$1.20,0.00,0.00%,25535452.00,United States,2023,7521,Finance,Real Estate
CWST,Casella Waste Systems Inc. Class A Common Stock,$90.68,-0.03,-0.033%,5259029492.00,United States,1997,302421,Utilities,Environmental Services
CXAI,CXApp Inc. Class A Common Stock,$1.38,-0.10,-6.757%,21051057.00,United States,2021,201637,Technology,EDP Services
CXAIW,CXApp Inc. Warrant,$0.0944,-0.0166,-14.955%,1440014.00,United States,2021,35700,Technology,EDP Services
CXDO,Crexendo Inc. Common Stock,$5.95,-0.11,-1.815%,154905894.00,United States,,238504,Telecommunications,Telecommunications Equipment
CYBR,CyberArk Software Ltd. Ordinary Shares,$244.07,-5.93,-2.372%,10014192100.00,Israel,2014,1571747,Technology,Computer Software: Prepackaged Software
CYCC,Cyclacel Pharmaceuticals Inc. Common Stock,$2.715,-0.215,-7.338%,2288351.00,United States,,19603,Health Care,Biotechnology: Pharmaceutical Preparations
CYCCP,Cyclacel Pharmaceuticals Inc. 6% Convertible Preferred Stock,$17.25,-0.45,-2.542%,14539249.00,United States,,407,Health Care,Biotechnology: Pharmaceutical Preparations
CYCN,Cyclerion Therapeutics Inc. Common Stock,$2.85,-0.01,-0.35%,6968524.00,United States,,1934,Health Care,Biotechnology: Pharmaceutical Preparations
CYN,Cyngn Inc. Common Stock,$0.1922,-0.0128,-6.244%,8034526.00,United States,2021,9152190,Technology,EDP Services
CYRX,CryoPort Inc. Common Stock,$16.10,0.21,1.322%,788315844.00,United States,,289011,Health Care,Biotechnology: Pharmaceutical Preparations
CYT,Cyteir Therapeutics Inc. Common Stock,$3.10,0.00,0.00%,111594011.00,United States,2021,27660,Health Care,Biotechnology: Pharmaceutical Preparations
CYTH,Cyclo Therapeutics Inc. Common Stock,$1.68,-0.07,-4.00%,38190435.00,United States,,36582,Health Care,Biotechnology: Pharmaceutical Preparations
CYTHW,Cyclo Therapeutics Inc. Warrant,$0.3056,-0.0044,-1.419%,6947022.00,United States,,146,Health Care,Biotechnology: Pharmaceutical Preparations
CYTK,Cytokinetics Incorporated Common Stock,$76.50,-0.39,-0.507%,7501103996.00,United States,2004,974346,Health Care,Biotechnology: Pharmaceutical Preparations
CYTO,Altamira Therapeutics Ltd. Common Shares,$1.775,-0.105,-5.585%,620363.00,Bermuda,2014,70264,Health Care,Biotechnology: Pharmaceutical Preparations
CZFS,Citizens Financial Services Inc. Common Stock,$47.44,-1.39,-2.847%,223257906.00,United States,,4869,Finance,Major Banks
CZNC,Citizens & Northern Corp Common Stock,$18.53,-0.49,-2.576%,283041414.00,United States,,16132,Finance,Major Banks
CZR,Caesars Entertainment Inc. Common Stock,$42.24,0.59,1.417%,9136502200.00,United States,,6625101,Consumer Discretionary,Hotels/Resorts
CZWI,Citizens Community Bancorp Inc. Common Stock,$12.02,0.01,0.083%,125826454.00,United States,2006,9244,Finance,Savings Institutions
DADA,Dada Nexus Limited American Depositary Shares,$2.21,0.12,5.742%,564612592.00,China,2020,2906201,Technology,Computer Software: Programming Data Processing
DAIO,Data I/O Corporation Common Stock,$3.23,-0.14,-4.154%,29137178.00,United States,1981,8365,Industrials,Electrical Products
DAKT,Daktronics Inc. Common Stock,$7.85,0.27,3.562%,362514303.00,United States,1994,467986,Consumer Discretionary,Miscellaneous manufacturing industries
DALN,DallasNews Corporation Series A Common Stock,$3.83,-0.06,-1.542%,20500037.00,United States,,27821,Consumer Discretionary,Newspapers/Magazines
DARE,Dare Bioscience Inc. Common Stock,$0.3618,0.0192,5.604%,35659856.00,United States,2014,161213,Health Care,Biotechnology: Pharmaceutical Preparations
DASH,DoorDash Inc. Class A Common Stock,$114.69,-0.79,-0.684%,46335242960.00,United States,,3487569,Industrials,Industrial Machinery/Components
DATS,DatChat Inc. Common Stock,$1.29,-0.02,-1.527%,2713284.00,United States,2021,18596,Technology,Computer Software: Prepackaged Software
DAVE,Dave Inc. Class A Common Stock,$22.63,-1.45,-6.022%,273854003.00,United States,,55926,Technology,Retail: Computer Software & Peripheral Equipment
DAVEW,Dave Inc. Warrants,$0.0368,0.0042,12.883%,445330.00,United States,,62874,Technology,Retail: Computer Software & Peripheral Equipment
DAWN,Day One Biopharmaceuticals Inc. Common Stock,$14.75,-0.14,-0.94%,1283883262.00,United States,2021,318379,Health Care,Biotechnology: Pharmaceutical Preparations
DBGI,Digital Brands Group Inc. Common Stock,$4.98,-0.0225,-0.45%,4272138.00,United States,2021,225313,Consumer Discretionary,Clothing/Shoe/Accessory Stores
DBGIW,Digital Brands Group Inc. Warrant,$7.40,0.00,0.00%,6348157.00,United States,2021,600,Consumer Discretionary,Clothing/Shoe/Accessory Stores
DBVT,DBV Technologies S.A. American Depositary Shares,$0.8101,0.0245,3.119%,156006714.00,France,2014,82769,Health Care,Biotechnology: Biological Products (No Diagnostic Substances)
DBX,Dropbox Inc. Class A Common Stock,$23.86,-0.37,-1.527%,8207462010.00,United States,2018,6417751,Technology,Computer Software: Prepackaged Software
DCBO,Docebo Inc. Common Shares,$45.94,-0.02,-0.044%,1457094508.00,Canada,,101462,,
DCFC,Tritium DCFC Limited Ordinary Shares,$0.1366,-0.0034,-2.429%,21861005.00,Australia,,1494135,Technology,Electronic Components
DCFCW,Tritium DCFC Limited Warrant,$0.07,0.00,0.00%,11202565.00,Australia,,16,Technology,Electronic Components
DCGO,DocGo Inc. Common Stock,$3.50,-0.09,-2.507%,363637152.00,United States,2020,515208,Health Care,Managed Health Care
DCOM,Dime Community Bancshares Inc. Common Stock,$19.05,-0.23,-1.193%,739537878.00,United States,,154842,Finance,Major Banks
DCOMP,Dime Community Bancshares Inc. Fixed-Rate Non-Cumulative Perpetual Preferred Stock Series A,$16.41,-0.20,-1.204%,637050739.00,United States,,6825,Finance,Major Banks
DCPH,Deciphera Pharmaceuticals Inc. Common Stock,$15.40,-0.15,-0.965%,1244320955.00,United States,2017,507626,Health Care,Biotechnology: Pharmaceutical Preparations
DCTH,Delcath Systems Inc. Common Stock,$4.21,-0.005,-0.119%,92814085.00,United States,,93980,Health Care,Medical/Dental Instruments
DDI,DoubleDown Interactive Co. Ltd. American Depository Shares,$12.99,-0.29,-2.184%,643699186.00,South Korea,2021,37250,Technology,EDP Services
DDOG,Datadog Inc. Class A Common Stock,$125.84,-1.82,-1.426%,41345194588.00,United States,2019,3501281,Technology,EDP Services
DECA,Denali Capital Acquisition Corp. Class A Ordinary Shares,$4.69,-0.1356,-2.81%,0.00,United States,2022,4407,Finance,Blank Checks
DECAU,Denali Capital Acquisition Corp. Unit,$4.88,0.00,0.00%,0.00,United States,2022,300,Finance,Blank Checks
DECAW,Denali Capital Acquisition Corp. Warrant,$0.0361,0.00,0.00%,0.00,United States,2022,100,Finance,Blank Checks
DENN,Denny's Corporation Common Stock,$9.11,-0.03,-0.328%,483608395.00,United States,,438677,Consumer Discretionary,Restaurants
DERM,Journey Medical Corporation Common Stock,$3.76,0.03,0.804%,69591768.00,United States,2021,55851,Health Care,Biotechnology: Pharmaceutical Preparations
DFLI,Dragonfly Energy Holdings Corp. Common Stock (NV),$0.5039,0.0124,2.523%,30007654.00,United States,2021,167618,Technology,Electronic Components
DGHI,Digihost Technology Inc. Common Subordinate Voting Shares,$1.79,-0.02,-1.105%,51692945.00,Canada,,66288,Finance,Finance: Consumer Services
DGICA,Donegal Group Inc. Class A Common Stock,$14.46,-0.26,-1.766%,480731781.00,United States,,32177,Finance,Property-Casualty Insurers
DGICB,Donegal Group Inc. Class B Common Stock,$13.42,-0.41,-2.965%,446156328.00,United States,1986,877,Finance,Property-Casualty Insurers
DGII,Digi International Inc. Common Stock,$30.00,-0.48,-1.575%,1087698360.00,United States,1989,119000,Technology,Computer peripheral equipment
DGLY,Digital Ally Inc. Common Stock,$2.09,0.085,4.239%,5853572.00,United States,,6321,Technology,Radio And Television Broadcasting And Communications Equipment
DH,Definitive Healthcare Corp. Class A Common Stock,$9.22,-0.50,-5.144%,1072544981.00,United States,2021,396147,Technology,Computer Software: Prepackaged Software
DHAC,Digital Health Acquisition Corp. Common Stock,$11.99,0.00,0.00%,43211552.00,United States,2021,5,Health Care,Medical/Nursing Services
DHACW,Digital Health Acquisition Corp. Warrant,$0.08,-0.02,-20.00%,288317.00,United States,2021,297065,Health Care,Medical/Nursing Services
DHAI,DIH Holdings US Inc. Class A Common Stock,$1.21,0.00,0.00%,13261953.00,United States,2024,361732,,
DHAIW,DIH Holding US Inc. Warrants,$0.024,0.0035,17.073%,263047.00,United States,2024,221550,Finance,Blank Checks
DHC,Diversified Healthcare Trust Common Shares of Beneficial Interest,$3.01,0.00,0.00%,723755550.00,United States,,833362,Real Estate,Real Estate Investment Trusts
DHCA,DHC Acquisition Corp. Class A ordinary share,$10.77,0.00,0.00%,0.00,United States,2021,41,Finance,Blank Checks
DHCAW,DHC Acquisition Corp. Warrant,$0.07,0.00,0.00%,0.00,United States,2021,10,Finance,Blank Checks
DHCNI,Diversified Healthcare Trust 5.625% Senior Notes due 2042,$14.4697,-0.3303,-2.232%,3479244415.00,United States,,3544,Real Estate,Real Estate Investment Trusts
DHCNL,Diversified Healthcare Trust 6.25% Senior Notes Due 2046,$15.14,-0.09,-0.591%,3640418284.00,United States,,7814,Real Estate,Real Estate Investment Trusts
DHIL,Diamond Hill Investment Group Inc. Class A Common Stock,$148.18,-2.52,-1.672%,426526202.00,United States,,7804,Finance,Investment Managers
DIBS,1stdibs.com Inc. Common Stock,$4.65,-0.03,-0.641%,185912803.00,United States,2021,47658,Consumer Discretionary,Catalog/Specialty Distribution
DIOD,Diodes Incorporated Common Stock,$68.27,0.36,0.53%,3136310419.00,United States,,314315,Technology,Semiconductors
DIST,Distoken Acquisition Corporation Ordinary Shares,$10.63,0.01,0.094%,0.00,China,2023,652,Finance,Blank Checks
DISTW,Distoken Acquisition Corporation Warrant,$0.0131,0.00,0.00%,0.00,China,2023,58,Finance,Blank Checks
DJCO,Daily Journal Corp. (S.C.) Common Stock,$327.08,-2.98,-0.903%,450397664.00,United States,,6696,Consumer Discretionary,Newspapers/Magazines
DKNG,DraftKings Inc. Class A Common Stock,$40.75,-0.57,-1.379%,35315314269.00,United States,2019,12370891,Consumer Discretionary,Services-Misc. Amusement & Recreation
DLHC,DLH Holdings Corp.,$16.27,0.03,0.185%,231533619.00,United States,,32446,Consumer Discretionary,Business Services
DLO,DLocal Limited Class A Common Shares,$15.94,-0.27,-1.666%,2584033400.00,Uruguay,2021,628720,Consumer Discretionary,Business Services
DLPN,Dolphin Entertainment Inc. Common Stock,$1.31,0.00,0.00%,23765161.00,United States,,6661,Consumer Discretionary,Other Consumer Services
DLTH,Duluth Holdings Inc. Class B Common Stock,$4.78,-0.06,-1.24%,164791748.00,United States,2015,53001,Consumer Discretionary,Clothing/Shoe/Accessory Stores
DLTR,Dollar Tree Inc. Common Stock,$145.43,-0.86,-0.588%,31685115798.00,United States,1995,2315995,Consumer Discretionary,Department/Specialty Retail Stores
DMAC,DiaMedica Therapeutics Inc. Common Stock,$2.90,-0.03,-1.024%,110065762.00,United States,2018,14576,Health Care,Pharmaceuticals and Biotechnology
DMLP,Dorchester Minerals L.P. Common Units Representing Limited Partnership Interests,$30.91,0.71,2.351%,1223518041.00,United States,,35477,Energy,Oil & Gas Production
DMRC,Digimarc Corporation Common Stock,$35.91,-1.33,-3.571%,731051112.00,United States,,56832,Technology,EDP Services
DMTK,DermTech Inc. Common Stock,$1.30,0.05,4.00%,44515929.00,United States,2017,228442,Health Care,Medical Specialities
DNLI,Denali Therapeutics Inc. Common Stock,$16.53,-0.01,-0.06%,2284393897.00,United States,2017,1210193,Health Care,Biotechnology: Biological Products (No Diagnostic Substances)
DNTH,Dianthus Therapeutics Inc. Common Stock,$23.97,0.10,0.419%,355181755.00,United States,2018,114325,Health Care,Biotechnology: Pharmaceutical Preparations
DNUT,Krispy Kreme Inc. Common Stock,$13.32,0.14,1.062%,2245752000.00,United States,2021,809701,Consumer Staples,Food Chains
DOCU,DocuSign Inc. Common Stock,$50.08,0.10,0.20%,10213009412.00,United States,2018,2375594,Technology,Computer Software: Prepackaged Software
DOGZ,Dogness (International) Corporation Class A Common Stock,$4.13,-0.1506,-3.518%,43867881.00,China,2017,6023,Consumer Discretionary,Miscellaneous manufacturing industries
DOMH,Dominari Holdings Inc. Common Stock,$2.0201,-0.0999,-4.712%,10798065.00,United States,,7565,Health Care,Biotechnology: Pharmaceutical Preparations
DOMO,Domo Inc. Class B Common Stock,$10.84,-0.30,-2.693%,396935846.00,United States,2018,319358,Technology,Computer Software: Prepackaged Software
DOOO,BRP Inc. (Recreational Products) Common Subordinate Voting Shares,$68.41,1.61,2.41%,5185930806.00,Canada,,142360,Consumer Discretionary,Industrial Specialties
DORM,Dorman Products Inc. Common Stock,$82.82,0.92,1.123%,2607845684.00,United States,,230124,Consumer Discretionary,Auto Parts:O.E.M.
DOX,Amdocs Limited Ordinary Shares,$89.62,-0.22,-0.245%,10516711539.00,Guernsey,,886514,Technology,EDP Services
