Symbol,Name,Last Sale,Net Change,% Change,Market Cap,Country,IPO Year,Volume,Sector,Industry
IMVT,Immunovant Inc. Common Stock,$36.50,-1.00,-2.667%,5303193405.00,United States,2019,859481,Health Care,Biotechnology: Biological Products (No Diagnostic Substances)
IMXI,International Money Express Inc. Common Stock,$20.99,0.10,0.479%,731858813.00,United States,2017,320822,Consumer Discretionary,Business Services
INAB,IN8bio Inc. Common Stock,$1.03,-0.015,-1.435%,32950864.00,United States,2021,118605,Health Care,Biotechnology: Pharmaceutical Preparations
INAQ,Insight Acquisition Corp. Class A Common Stock,$10.78,0.02,0.186%,0.00,United States,,1073,Finance,Blank Checks
INBK,First Internet Bancorp Common Stock,$32.17,-0.54,-1.651%,278066960.00,United States,,31298,Finance,Major Banks
INBS,Intelligent Bio Solutions Inc. Common Stock,$4.04,-0.20,-4.717%,8677068.00,United States,2020,121195,Health Care,Medical Specialities
INBX,Inhibrx Inc. Common Stock,$38.28,0.22,0.578%,1810286694.00,United States,2020,174312,Health Care,Biotechnology: Pharmaceutical Preparations
INCR,Intercure Ltd. Ordinary Shares,$1.93,-0.10,-4.926%,87955290.00,Israel,,128331,Health Care,Biotechnology: Pharmaceutical Preparations
INCY,Incyte Corp. Common Stock,$60.33,1.51,2.567%,13545661302.00,United States,,1960923,Health Care,Biotechnology: Commercial Physical & Biological Resarch
INDB,Independent Bank Corp. Common Stock,$52.98,-0.21,-0.395%,2323348205.00,United States,,190706,Finance,Major Banks
INDI,indie Semiconductor Inc. Class A Common Stock,$7.06,-0.18,-2.486%,1272907050.00,United States,,2419184,Technology,Semiconductors
INDP,Indaptus Therapeutics Inc. Common Stock,$1.70,0.00,0.00%,14281780.00,United States,,6370,Health Care,Biotechnology: Pharmaceutical Preparations
INDV,Indivior PLC Ordinary Shares,$17.50,0.84,5.042%,2412875133.00,United Kingdom,,166577,Health Care,Biotechnology: Pharmaceutical Preparations
INFN,Infinera Corporation Common Stock,$4.88,-0.16,-3.175%,1107387998.00,United States,2007,1505911,Utilities,Telecommunications Equipment
INGN,Inogen Inc Common Stock,$9.39,-0.10,-1.054%,218860373.00,United States,2014,564785,Health Care,Industrial Specialties
INHD,Inno Holdings Inc. Common Stock,$1.20,-0.03,-2.439%,24902071.00,United States,2023,31976,,
INKT,MiNK Therapeutics Inc. Common Stock,$0.92,-0.0189,-2.013%,31757977.00,United States,2021,31071,Health Care, Medicinal Chemicals and Botanical Products 
INM,InMed Pharmaceuticals Inc. Common Shares,$0.4035,0.0275,7.314%,2443987.00,Canada,,380600,Health Care,Biotechnology: Pharmaceutical Preparations
INMB,INmune Bio Inc. Common stock,$12.59,-0.91,-6.741%,226893102.00,United States,2019,79334,Health Care,Biotechnology: Biological Products (No Diagnostic Substances)
INMD,InMode Ltd. Ordinary Shares,$20.84,-0.13,-0.62%,1750194508.00,Israel,2019,2203104,Health Care,Biotechnology: Electromedical & Electrotherapeutic Apparatus
INNV,InnovAge Holding Corp. Common Stock,$5.14,0.25,5.112%,698523096.00,United States,2021,17311,Health Care,Medical/Nursing Services
INO,Inovio Pharmaceuticals Inc. Common Stock,$7.89,-0.28,-3.427%,179490754.00,United States,,288876,Health Care,Medical/Dental Instruments
INOD,Innodata Inc. Common Stock,$8.50,-0.24,-2.746%,244031141.00,United States,1993,564843,Technology,EDP Services
INPX,Inpixon Common Stock,$0.0495,-0.0009,-1.786%,6320583.00,United States,2014,4310060,Technology,EDP Services
INSE,Inspired Entertainment Inc. Common Stock,$9.33,0.10,1.083%,245720347.00,United States,2014,54127,Technology,Computer Software: Prepackaged Software
INSG,Inseego Corp. Common Stock,$3.13,-0.19,-5.723%,36630922.00,United States,,45686,Telecommunications,Telecommunications Equipment
INSM,Insmed Incorporated Common Stock,$28.24,-0.97,-3.321%,4040072716.00,United States,,1611389,Health Care,Biotechnology: Pharmaceutical Preparations
INTA,Intapp Inc. Common Stock,$40.39,-0.68,-1.656%,2918593032.00,United States,2021,528892,Technology,Computer Software: Prepackaged Software
INTC,Intel Corporation Common Stock,$43.47,-1.05,-2.358%,183791160000.00,United States,,57714970,Technology,Semiconductors
INTE,Integral Acquisition Corporation 1 Class A Common Stock,$10.84,0.00,0.00%,0.00,United States,2021,5,Finance,Blank Checks
INTG,Intergroup Corporation (The) Common Stock,$21.02,0.00,0.00%,46757792.00,United States,,149,Consumer Discretionary,Hotels/Resorts
INTR,Inter & Co. Inc. Class A Common Shares,$5.30,-0.03,-0.563%,1509281000.00,Brazil,,717564,,
INTS,Intensity Therapeutics Inc. Common stock,$3.00,0.05,1.695%,41128131.00,United States,2023,59403,Health Care,Biotechnology: Pharmaceutical Preparations
INTU,Intuit Inc. Common Stock,$638.27,-7.64,-1.183%,178674750720.00,United States,1993,1146180,Technology,Computer Software: Prepackaged Software
INTZ,Intrusion Inc. Common Stock,$0.2059,-0.044,-17.607%,7467775.00,United States,,877814,Telecommunications,Computer Communications Equipment
INVA,Innoviva Inc. Common Stock,$15.67,-0.13,-0.823%,1004238197.00,United States,2004,720392,Health Care,Biotechnology: Pharmaceutical Preparations
INVE,Identiv Inc. Common Stock,$8.77,-0.20,-2.23%,203239058.00,United States,,58766,Technology,Computer peripheral equipment
INVO,INVO BioScience Inc. Common Stock,$0.9001,-0.0399,-4.245%,2227528.00,United States,,37626,Health Care,Medical/Dental Instruments
INVZ,Innoviz Technologies Ltd. Ordinary shares,$1.63,-0.02,-1.212%,221989700.00,Israel,,2199844,Consumer Discretionary,Auto Parts:O.E.M.
INVZW,Innoviz Technologies Ltd. Warrant,$0.35,0.0379,12.144%,47664842.00,Israel,,17543,Consumer Discretionary,Auto Parts:O.E.M.
INZY,Inozyme Pharma Inc. Common Stock,$5.64,-0.14,-2.422%,348330619.00,United States,2020,333739,Health Care,Biotechnology: Pharmaceutical Preparations
IOBT,IO Biotech Inc. Common Stock,$1.50,-0.06,-3.846%,98821371.00,Denmark,2021,142174,Health Care,Biotechnology: Pharmaceutical Preparations
IONM,Assure Holdings Corp. Common Stock,$0.344,-0.009,-2.55%,2311838.00,United States,,339955,Health Care,Medical/Dental Instruments
IONR,ioneer Ltd American Depositary Shares,$3.52,0.21,6.344%,184696009.00,Australia,,51987,,
IONS,Ionis Pharmaceuticals Inc. Common Stock,$43.53,-0.82,-1.849%,6245341340.00,United States,,2095188,Health Care,Biotechnology: Pharmaceutical Preparations
IOSP,Innospec Inc. Common Stock,$123.50,0.14,0.113%,3071196642.00,United States,,55632,Industrials,Major Chemicals
IOVA,Iovance Biotherapeutics Inc. Common Stock,$15.77,3.74,31.089%,4035833925.00,United States,,64322803,Health Care,Biotechnology: Biological Products (No Diagnostic Substances)
IPA,ImmunoPrecise Antibodies Ltd. Common Stock,$1.72,-0.14,-7.527%,43086447.00,Canada,,140754,Health Care,Biotechnology: Pharmaceutical Preparations
IPAR,Inter Parfums Inc. Common Stock,$152.22,-0.43,-0.282%,4868118137.00,United States,,85152,Consumer Discretionary,Package Goods/Cosmetics
IPDN,Professional Diversity Network Inc. Common Stock,$2.10,-0.033,-1.547%,23248016.00,United States,2013,1604,Technology,EDP Services
IPGP,IPG Photonics Corporation Common Stock,$86.45,0.17,0.197%,4056446148.00,United States,2006,264235,Technology,Semiconductors
IPHA,Innate Pharma S.A. ADS,$2.53,-0.06,-2.317%,201242846.00,France,2019,749,Health Care,Biotechnology: Biological Products (No Diagnostic Substances)
IPSC,Century Therapeutics Inc. Common Stock,$4.16,-0.45,-9.761%,248913467.00,United States,2021,4177299,Health Care, Medicinal Chemicals and Botanical Products 
IPW,iPower Inc. Common Stock,$0.7405,0.0505,7.319%,22080441.00,United States,2021,19465,Consumer Discretionary,Catalog/Specialty Distribution
IPWR,Ideal Power Inc. Common Stock,$10.51,2.81,36.494%,62485597.00,United States,2013,135559,Technology,Semiconductors
IPX,IperionX Limited American Depositary Share,$15.00,0.38,2.599%,290240955.00,United States,,29395,Consumer Discretionary,Diversified Commercial Services
IPXX,Inflection Point Acquisition Corp. II Class A Ordinary Share,$10.43,-0.01,-0.096%,0.00,United States,2023,84783,Finance,Blank Checks
IPXXW,Inflection Point Acquisition Corp. II Warrant,$0.16,0.02,14.286%,0.00,United States,2023,100,Finance,Blank Checks
IQ,iQIYI Inc. American Depositary Shares,$3.62,0.03,0.836%,3251576426.00,China,2018,5822636,Consumer Discretionary,Consumer Electronics/Video Chains
IRAA,Iris Acquisition Corp Class A Common Stock,$10.32,0.00,0.00%,0.00,United States,2021,106,Finance,Blank Checks
IRBT,iRobot Corporation Common Stock,$12.05,-0.25,-2.033%,335780540.00,United States,2005,1124429,Consumer Discretionary,Consumer Electronics/Appliances
IRDM,Iridium Communications Inc Common Stock,$29.50,0.29,0.993%,3612168387.00,United States,,1072000,Telecommunications,Telecommunications Equipment
IREN,Iris Energy Limited Ordinary Shares,$6.64,-0.23,-3.348%,445480063.00,Australia,2021,5323938,Technology,EDP Services
IRIX,IRIDEX Corporation Common Stock,$2.45,-0.22,-8.24%,39807142.00,United States,1996,24807,Health Care,Biotechnology: Electromedical & Electrotherapeutic Apparatus
IRMD,iRadimed Corporation Common Stock,$43.31,-1.59,-3.541%,545947540.00,United States,2014,58907,Health Care,Medical/Dental Instruments
IROH,Iron Horse Acquisitions Corp. Common Stock,$10.015,-0.005,-0.05%,0.00,United States,2024,98559,,
IROHR,Iron Horse Acquisitions Corp. Right,$0.22,0.02,10.00%,0.00,United States,2024,50700,,
IROHU,Iron Horse Acquisitions Corp. Unit,$10.25,0.01,0.098%,0.00,United States,2023,3094,,
IROHW,Iron Horse Acquisitions Corp. Warrant,$0.03,-0.0148,-33.036%,0.00,United States,2024,57862,,
IRON,Disc Medicine Inc. Common Stock,$64.86,-1.56,-2.349%,1565748160.00,United States,,286209,Health Care,Biotechnology: Pharmaceutical Preparations
IROQ,IF Bancorp Inc. Common Stock,$16.50,-0.10,-0.602%,55351329.00,United States,2011,3397,Finance,Finance: Consumer Services
IRTC,iRhythm Technologies Inc. Common Stock,$111.92,-0.25,-0.223%,3430432835.00,United States,2016,227069,Health Care,Medical/Dental Instruments
IRWD,Ironwood Pharmaceuticals Inc. Class A Common Stock,$15.14,0.31,2.09%,2369843731.00,United States,2010,3625380,Health Care,Biotechnology: Pharmaceutical Preparations
ISPC,iSpecimen Inc. Common Stock,$0.479,-0.001,-0.208%,4347312.00,United States,2021,3149,Health Care,Precision Instruments
ISPO,Inspirato Incorporated Class A Common Stock,$4.28,0.01,0.234%,14273158.00,United States,2021,1595,Finance,Blank Checks
ISPR,Ispire Technology Inc. Common Stock,$10.49,-1.13,-9.725%,569390864.00,United States,2023,161897,Health Care, Medicinal Chemicals and Botanical Products 
ISRG,Intuitive Surgical Inc. Common Stock,$380.23,2.59,0.686%,133964862888.00,United States,2000,1216678,Health Care,Medical/Dental Instruments
ISRL,Israel Acquisitions Corp Class A Ordinary Shares,$10.735,0.005,0.047%,0.00,United States,2023,964,Finance,Blank Checks
ISRLU,Israel Acquisitions Corp Unit,$10.9107,0.00,0.00%,0.00,United States,2023,31,Finance,Blank Checks
ISRLW,Israel Acquisitions Corp Warrant,$0.035,-0.0307,-46.728%,0.00,United States,2023,43300,Finance,Blank Checks
ISSC,Innovative Solutions and Support Inc. Common Stock,$8.30,-0.18,-2.123%,144917859.00,United States,2000,82850,Technology,EDP Services
ISTR,Investar Holding Corporation Common Stock,$16.61,-0.20,-1.19%,162108418.00,United States,2014,50373,Finance,Major Banks
ISUN,iSun Inc. Common Stock,$0.1936,-0.0122,-5.928%,9162796.00,United States,2016,375490,Technology,Semiconductors
ITCI,Intra-Cellular Therapies Inc. Common Stock,$73.28,-0.42,-0.57%,7052329873.00,United States,,752780,Health Care,Biotechnology: Pharmaceutical Preparations
ITI,Iteris Inc. Common Stock,$4.80,-0.13,-2.637%,205958515.00,United States,,163483,Telecommunications,Telecommunications Equipment
ITIC,Investors Title Company Common Stock,$156.25,0.05,0.032%,295409844.00,United States,,1148,Finance,Specialty Insurers
ITOS,iTeos Therapeutics Inc. Common Stock,$10.55,0.27,2.626%,377531307.00,United States,2020,154292,Health Care,Biotechnology: Biological Products (No Diagnostic Substances)
ITRI,Itron Inc. Common Stock,$74.42,-0.98,-1.30%,3385571943.00,United States,1993,307257,Industrials,Electrical Products
ITRM,Iterum Therapeutics plc Ordinary Share,$1.44,-0.03,-2.041%,19346959.00,Ireland,2018,140656,Health Care,Biotechnology: Pharmaceutical Preparations
ITRN,Ituran Location and Control Ltd. Ordinary Shares,$25.78,-0.29,-1.112%,518435800.00,Israel,2005,35468,Technology,Electronic Components
IVA,Inventiva S.A. American Depository Shares,$3.27,-0.09,-2.679%,137778733.00,France,2020,4333,Health Care,Biotechnology: Pharmaceutical Preparations
IVAC,Intevac Inc. Common Stock,$3.81,0.05,1.33%,101255170.00,United States,1995,54938,Technology,Industrial Machinery/Components
IVCA,Investcorp India Acquisition Corp. Class A Ordinary Share,$11.08,0.00,0.00%,0.00,Cayman Islands,2022,70,Finance,Blank Checks
IVCB,Investcorp Europe Acquisition Corp I Class A Ordinary Shares,$11.08,0.00,0.00%,0.00,Cayman Islands,2022,174,Finance,Blank Checks
IVCP,Swiftmerge Acquisition Corp. Class A Ordinary Share,$10.95,0.05,0.459%,307968750.00,United States,2022,18957,Finance,Blank Checks
IVCPU,Swiftmerge Acquisition Corp. Unit,$10.80,0.06,0.559%,0.00,United States,2021,1007,Finance,Blank Checks
IVCPW,Swiftmerge Acquisition Corp. Warrants,$0.0157,0.00,0.00%,0.00,United States,2022,26,Finance,Blank Checks
IVDA,Iveda Solutions Inc. Common Stock,$1.01,-0.062,-5.784%,16230590.00,United States,,463821,Technology,Computer Software: Prepackaged Software
IVDAW,Iveda Solutions Inc. Warrant,$0.1995,-0.0215,-9.729%,3205943.00,United States,,9701,Technology,Computer Software: Prepackaged Software
IVP,Inspire Veterinary Partners Inc. Class A Common Stock,$0.1098,-0.0244,-18.182%,932924.00,United States,2023,92421087,Miscellaneous,Diversified Commercial Services
IVVD,Invivyd Inc. Common Stock,$3.99,-0.11,-2.683%,439358690.00,United States,2021,238777,Health Care,Biotechnology: Pharmaceutical Preparations
IXAQ,IX Acquisition Corp. Class A Ordinary Share,$11.12,0.00,0.00%,0.00,United Kingdom,2021,1,Finance,Blank Checks
IXHL,Incannex Healthcare Inc. Common Stock,$6.30,1.92,43.836%,100000612.00,Australia,,1017548,,
IZEA,IZEA Worldwide Inc. Common Stock,$1.91,-0.13,-6.373%,29517457.00,United States,,26968,Consumer Discretionary,Advertising
IZM,ICZOOM Group Inc. Class A Ordinary Shares,$8.17,0.10,1.239%,84724191.00,China,2023,221546,Consumer Discretionary,Consumer Electronics/Video Chains
JACK,Jack In The Box Inc. Common Stock,$73.95,0.25,0.339%,1446247471.00,United States,,574464,Consumer Discretionary,Restaurants
JAGX,Jaguar Health Inc. Common Stock,$0.0673,-0.0031,-4.403%,3415851.00,United States,2015,10176555,Health Care,Biotechnology: Pharmaceutical Preparations
JAKK,JAKKS Pacific Inc. Common Stock,$33.60,0.02,0.06%,338461670.00,United States,1996,35251,Consumer Discretionary,Recreational Games/Products/Toys
JAMF,Jamf Holding Corp. Common Stock,$19.96,-0.74,-3.575%,2510883609.00,United States,2020,764101,Technology,Computer Software: Prepackaged Software
JAN,JanOne Inc. Common Stock (NV),$0.91,-0.046,-4.812%,4511459.00,United States,,258326,Consumer Discretionary,Home Furnishings
JANX,Janux Therapeutics Inc. Common Stock,$13.14,3.18,31.928%,606653170.00,United States,2021,1119297,Health Care,Biotechnology: Pharmaceutical Preparations
JAZZ,Jazz Pharmaceuticals plc Common Stock (Ireland),$128.42,2.06,1.63%,8084926767.00,Ireland,2007,302241,Health Care,Biotechnology: Pharmaceutical Preparations
JBHT,J.B. Hunt Transport Services Inc. Common Stock,$203.18,3.45,1.727%,20956555120.00,United States,,927540,Industrials,Trucking Freight/Courier Services
JBLU,JetBlue Airways Corporation Common Stock,$6.71,-0.30,-4.28%,2276548589.00,United States,2002,13094298,Consumer Discretionary,Air Freight/Delivery Services
JBSS,John B. Sanfilippo & Son Inc. Common Stock,$99.69,-1.18,-1.17%,1156412573.00,United States,1991,83855,Consumer Staples,Specialty Foods
JCSE,JE Cleantech Holdings Limited Ordinary Shares,$0.8358,0.0103,1.248%,4184572.00,Singapore,2022,5397,Consumer Discretionary,Miscellaneous manufacturing industries
JCTCF,Jewett-Cameron Trading Company Common Shares,$5.33,-0.22,-3.964%,18680595.00,United States,,277,,
JD,JD.com Inc. American Depositary Shares,$23.79,0.56,2.411%,37386186311.00,China,2014,10660785,Consumer Discretionary,Other Specialty Stores
JEWL,Adamas One Corp. Common Stock,$0.5177,-0.0323,-5.873%,14492476.00,United States,2022,94361,Consumer Discretionary,Consumer Specialties
JFBR,Jeffs' Brands Ltd Ordinary Shares,$1.70,-0.57,-25.11%,2020969.00,Israel,2022,111822,Consumer Discretionary,Other Specialty Stores
JFIN,Jiayin Group Inc. American Depositary Shares,$5.55,0.115,2.116%,296546773.00,China,2019,15247,Finance,Finance: Consumer Services
JFU,9F Inc. American Depositary Shares,$2.90,-0.09,-3.01%,34142666.00,China,2019,1172,Finance,Finance: Consumer Services
JG,Aurora Mobile Limited American Depositary Shares,$2.44,-0.6852,-21.925%,14592444.00,China,2018,24562,Technology,Computer Software: Programming Data Processing
JJSF,J & J Snack Foods Corp. Common Stock,$145.62,0.16,0.11%,2822093320.00,United States,1986,67228,Consumer Staples,Specialty Foods
JKHY,Jack Henry & Associates Inc. Common Stock,$172.13,-0.97,-0.56%,12542713414.00,United States,1985,287613,Technology,Retail: Computer Software & Peripheral Equipment
JL,J-Long Group Limited Ordinary Shares,$18.20,0.59,3.35%,571480000.00,Hong Kong,2024,118319,,
JMSB,John Marshall Bancorp Inc. Common Stock,$17.50,-0.12,-0.681%,247206470.00,United States,,13703,Finance,Major Banks
JNVR,Janover Inc. Common Stock,$1.26,-0.03,-2.326%,12593792.00,United States,2023,11984,Finance,Finance: Consumer Services
JOAN,JOANN Inc. Common Stock,$0.5062,0.0205,4.221%,21215678.00,United States,2021,207606,Consumer Discretionary,Other Specialty Stores
JOUT,Johnson Outdoors Inc. Class A Common Stock,$44.72,-0.27,-0.60%,459886527.00,United States,,60637,Consumer Discretionary,Recreational Games/Products/Toys
JRSH,Jerash Holdings (US) Inc. Common Stock,$3.09,0.02,0.651%,37991056.00,United States,2018,11696,Consumer Discretionary,Apparel
JRVR,James River Group Holdings Ltd. Common Shares,$10.41,-0.39,-3.611%,391827903.00,Bermuda,2014,878701,Finance,Property-Casualty Insurers
JSM,Navient Corporation 6% Senior Notes due December 15 2043,$20.72,-0.1799,-0.861%,2436073006.00,United States,,16914,Finance,Finance: Consumer Services
JSPR,Jasper Therapeutics Inc. Common Stock,$18.91,-0.53,-2.726%,210988817.00,United States,2020,44333,Health Care,Biotechnology: Biological Products (No Diagnostic Substances)
JSPRW,Japer Therapeutics Inc. Warrants,$0.1838,-0.0011,-0.595%,2050753.00,United States,2020,2253,Health Care,Biotechnology: Biological Products (No Diagnostic Substances)
JTAI,Jet.AI Inc. Common Stock,$0.93,-0.008,-0.853%,8384335.00,Cayman Islands,2021,314294,Finance,Blank Checks
JTAIZ,Jet.AI Inc. Merger Consideration Warrants,$0.5501,0.00,0.00%,4959379.00,Cayman Islands,,18,,
JVA,Coffee Holding Co. Inc. Common Stock,$1.30,0.00,0.00%,7421179.00,United States,2005,34705,Consumer Staples,Packaged Foods
JVSAU,JVSPAC Acquisition Corp. Unit,$10.19,0.00,0.00%,0.00,China,2024,579,,
JWEL,Jowell Global Ltd. Ordinary Shares,$1.941,0.081,4.355%,4139736.00,China,2021,986,Consumer Discretionary,Other Consumer Services
JXJT,JX Luxventure Limited Common Stock,$2.23,-0.02,-0.889%,13513800.00,China,2013,1197559,Consumer Staples,Apparel
JYD,Jayud Global Logistics Limited Class A Ordinary Shares,$1.0599,-0.0101,-0.944%,22721606.00,China,2023,5921,Consumer Discretionary,Oil Refining/Marketing
JYNT,The Joint Corp. Common Stock,$10.06,-0.23,-2.235%,148428127.00,United States,2014,60696,Miscellaneous,Multi-Sector Companies
JZ,Jianzhi Education Technology Group Company Limited American Depositary Shs,$2.07,-0.81,-28.125%,41782950.00,China,2022,121966,Real Estate,Other Consumer Services
JZXN,Jiuzi Holdings Inc. Ordinary Shares,$1.01,-0.05,-4.717%,2610643.00,China,2021,111309,Consumer Discretionary,Retail-Auto Dealers and Gas Stations
KA,Kineta Inc. Common Stock,$2.60,0.00,0.00%,27023274.00,United States,2016,5531,Health Care,Biotechnology: Pharmaceutical Preparations
KACL,Kairous Acquisition Corp. Limited Ordinary Shares,$11.70,-0.04,-0.341%,0.00,Malaysia,2022,217860,Finance,Blank Checks
KALA,KALA BIO Inc. Common Stock,$7.14,-0.03,-0.418%,19228848.00,United States,2017,2778,Health Care,Biotechnology: Pharmaceutical Preparations
KALU,Kaiser Aluminum Corporation Common Stock,$66.08,0.31,0.471%,1058236442.00,United States,,134081,Industrials,Metal Fabrications
KALV,KalVista Pharmaceuticals Inc. Common Stock,$13.04,-0.76,-5.507%,540348521.00,United Kingdom,2015,1011246,Health Care,Biotechnology: Pharmaceutical Preparations
KARO,Karooooo Ltd. Ordinary Shares,$24.72,-0.04,-0.162%,765111340.00,Singapore,2021,4926,Technology,Computer Software: Prepackaged Software
KAVL,Kaival Brands Innovations Group Inc. Common Stock,$2.1849,-0.1051,-4.59%,6218957.00,United States,,9171,Health Care, Medicinal Chemicals and Botanical Products 
KC,Kingsoft Cloud Holdings Limited American Depositary Shares,$2.76,0.10,3.759%,700172402.00,China,2020,1117339,Technology,Computer Software: Prepackaged Software
KDP,Keurig Dr Pepper Inc. Common Stock,$31.60,0.37,1.185%,44187420855.00,United States,,11468267,Consumer Staples,Beverages (Production/Distribution)
KE,Kimball Electronics Inc. Common Stock,$22.02,-0.12,-0.542%,547619916.00,United States,,137890,Technology,Electrical Products
KELYA,Kelly Services Inc. Class A Common Stock,$23.61,0.11,0.468%,833164058.00,United States,,255278,Consumer Discretionary,Professional Services
KELYB,Kelly Services Inc. Class B Common Stock,$22.65,0.00,0.00%,799286994.00,United States,,37,Consumer Discretionary,Professional Services
KEQU,Kewaunee Scientific Corporation Common Stock,$28.5601,0.3601,1.277%,82872014.00,United States,,2275,Industrials,Medical Specialities
KFFB,Kentucky First Federal Bancorp Common Stock,$3.85,-0.07,-1.786%,31133853.00,United States,2005,708,Finance,Savings Institutions
KFRC,Kforce Inc. Common Stock,$67.97,-0.18,-0.264%,1343019230.00,United States,1995,101260,Consumer Discretionary,Professional Services
KGEI,Kolibri Global Energy Inc. Common stock,$2.985,-0.055,-1.809%,106342377.00,United States,,5890,Energy,Oil & Gas Production
KHC,The Kraft Heinz Company Common Stock,$36.39,0.77,2.162%,44144701249.00,United States,,9722599,Consumer Staples,Packaged Foods
KIDS,OrthoPediatrics Corp. Common Stock,$28.14,-0.65,-2.258%,657164226.00,United States,2017,96324,Health Care,Medical/Dental Instruments
KINS,Kingstone Companies Inc. Common Stock,$3.235,0.085,2.698%,34806433.00,United States,,19863,Finance,Property-Casualty Insurers
KIRK,Kirkland's Inc. COMMONSTOCK,$2.65,-0.10,-3.636%,34247744.00,United States,2002,178546,Consumer Discretionary,Other Specialty Stores
KITT,Nauticus Robotics Inc. Common stock,$0.297,-0.002,-0.669%,14860640.00,United States,2021,213768,Industrials,Industrial Machinery/Components
KITTW,Nauticus Robotics Inc. Warrant,$0.029,0.0071,32.42%,1451039.00,United States,2021,3750,Industrials,Industrial Machinery/Components
KLAC,KLA Corporation Common Stock,$651.92,0.15,0.023%,88161521760.00,United States,1980,746149,Technology,Electronic Components
KLIC,Kulicke and Soffa Industries Inc. Common Stock,$48.45,-0.14,-0.288%,2729726634.00,Singapore,,343471,Technology,Semiconductors
KLTR,Kaltura Inc. Common Stock,$1.45,-0.02,-1.361%,205038159.00,United States,2021,126732,Technology,EDP Services
KLXE,KLX Energy Services Holdings Inc. Common Stock,$9.00,-0.24,-2.597%,147666888.00,United States,,96736,Energy,Oilfield Services/Equipment
KMDA,Kamada Ltd. Ordinary Shares,$6.01,-0.045,-0.743%,269488400.00,Israel,2013,1862,Health Care,Biotechnology: Pharmaceutical Preparations
KNDI,Kandi Technologies Group Inc Common Stock,$2.67,0.00,0.00%,233685876.00,China,,41563,Consumer Discretionary,Auto Manufacturing
KNSA,Kiniksa Pharmaceuticals Ltd. Class A Common Stock,$19.96,0.04,0.201%,1403953546.00,United States,2018,200597,Health Care,Biotechnology: Pharmaceutical Preparations
KNTE,Kinnate Biopharma Inc. Common Stock,$2.43,-0.11,-4.331%,114483856.00,United States,2020,1032079,Health Care,Biotechnology: Pharmaceutical Preparations
KOD,Kodiak Sciences Inc Common Stock,$5.21,-0.20,-3.697%,273380636.00,United States,2018,558111,Health Care,Biotechnology: Biological Products (No Diagnostic Substances)
KOPN,Kopin Corporation Common Stock,$2.35,-0.14,-5.622%,268955465.00,United States,1992,1049705,Technology,Semiconductors
KOSS,Koss Corporation Common Stock,$2.61,-0.06,-2.247%,24155015.00,United States,,20554,Consumer Staples,Consumer Electronics/Appliances
KPLT,Katapult Holdings Inc. Common Stock,$13.84,-0.36,-2.535%,56262022.00,United States,2019,2132,Consumer Discretionary,Diversified Commercial Services
KPLTW,Katapult Holdings Inc. Warrant,$0.01,0.0006,6.383%,40652.00,United States,2019,4907,Consumer Discretionary,Diversified Commercial Services
KPRX,Kiora Pharmaceuticals Inc.  Common Stock,$0.5957,-0.0623,-9.468%,15419149.00,United States,,234141,Health Care,Biotechnology: Pharmaceutical Preparations
KPTI,Karyopharm Therapeutics Inc. Common Stock,$1.21,0.00,0.00%,138586129.00,United States,2013,1349119,Health Care,Biotechnology: Pharmaceutical Preparations
KRKR,36Kr Holdings Inc. American Depositary Shares,$0.3667,-0.0204,-5.27%,14293504.00,China,2019,82823,Consumer Discretionary,Business Services
KRMD,KORU Medical Systems Inc. Common Stock (DE),$2.07,-0.04,-1.896%,94535579.00,United States,,34222,Health Care,Medical/Dental Instruments
KRNL,Kernel Group Holdings Inc. Class A Ordinary Shares,$10.79,0.00,0.00%,0.00,United States,2021,2,Finance,Blank Checks
KRNLU,Kernel Group Holdings Inc. Units,$10.77,0.00,0.00%,0.00,United States,2021,378,Finance,Blank Checks
KRNLW,Kernel Group Holdings Inc. Warrants,$0.049,0.0096,24.365%,0.00,United States,2021,11100,Finance,Blank Checks
